{"run":42,"commit":"0e5725d","metric":0,"metrics":{"pane_median":0,"pane_max":0,"idle_pane_p95":0,"active_idle_pane_gap":0},"status":"crash","description":"Tried increasing the stabilized tmux benchmark from 4 to 8 draft tokens per session so per-session p95 would be less sensitive to a single spike.","timestamp":1774405849225,"segment":3,"confidence":null,"asi":{"hypothesis":"A larger per-session token sample may make the tmux p95 benchmark more tail-stable without changing what it measures.","learned":"At the current implementation, 8 tokens per session made the benchmark too slow for the existing timeout budget, so this straightforward stability tweak is not practical as-is.","rollback_reason":"run_experiment timed out at ~179s before producing a metric.","next_action_hint":"If benchmark stabilization remains necessary, try a smaller token count increase or reduce session/repeat count rather than jumping straight to 8 tokens per session.","failure_mode":"timeout after raising TOKENS_PER_SESSION to 8"}}
{"type":"config","name":"Active-request tmux draft visibility latency","metricName":"pane_p95","metricUnit":"ms","bestDirection":"lower"}
{"run":43,"commit":"0e5725d","metric":33.405,"metrics":{"pane_median":33.262,"pane_max":33.405,"idle_pane_p95":35.053,"active_idle_pane_gap":-1.649},"status":"keep","description":"Restored the practical one-token tmux benchmark after the multi-token redesign failed stability/time-budget checks; current branch baseline is back in the low-30 ms pane-visibility range.","timestamp":1774405971397,"segment":4,"confidence":null,"asi":{"hypothesis":"The simpler one-token tmux proxy, despite some noise, is still the most practical guide right now because the multi-token redesign was not yet trustworthy.","learned":"Returning to the original tmux workload re-established a low-30 ms baseline immediately, confirming the branch is still fast on the practical user-facing proxy and that the multi-token benchmark detour was not ready to replace it.","benchmark_state":"One-token tmux benchmark restored as active optimization target; multi-token stabilization remains deferred in ideas.","current_setting":"150 ms recent-keypress thought deferral remains the stable live-thought compromise."}}
{"run":44,"commit":"0e5725d","metric":61.285,"metrics":{"pane_median":32.826,"pane_max":61.285,"idle_pane_p95":34.228,"active_idle_pane_gap":27.057},"status":"discard","description":"Tried shortening the recent-keypress thought deferral slightly from 150 ms to 140 ms under the restored one-token tmux benchmark.","timestamp":1774406029822,"segment":4,"confidence":null,"asi":{"hypothesis":"A very small reduction from 150 ms might preserve the stable behavior while letting thoughts resume a bit sooner.","learned":"Even a 10 ms reduction produced another large pane-p95 spike, so the stable region appears to have a sharp boundary and 150 ms remains the safer setting.","rollback_reason":"Primary metric regressed from 33.41 ms to 61.29 ms.","next_action_hint":"Avoid further micro-tuning around the current keypress deferral window unless the benchmark is first made less spike-sensitive.","candidate":"recent keypress defer 140 ms"}}
{"run":45,"commit":"0e5725d","metric":59.998,"metrics":{"pane_median":33.37,"pane_max":59.998,"idle_pane_p95":35.509,"active_idle_pane_gap":24.489},"status":"discard","description":"No-code confirmation rerun of the restored one-token tmux benchmark to measure current noise before trusting any more tiny timing tweaks.","timestamp":1774406131441,"segment":4,"confidence":null,"asi":{"hypothesis":"The restored one-token tmux workload may still be too noisy to support sub-millisecond optimization decisions, so a pure rerun should reveal the noise floor.","learned":"A no-code rerun spiked from 33.4 ms to 60.0 ms pane p95 while median stayed ~33 ms, confirming the current primary metric is dominated by single-sample tail noise and should not be used to justify tiny tuning wins.","rollback_reason":"No code change; rerun was intentionally used to measure benchmark noise and came back much worse.","next_action_hint":"Prioritize benchmark stabilization or switch to a tail-robust aggregation before making more micro-optimizations against this metric.","experiment_type":"noise check rerun on unchanged code"}}
{"run":46,"commit":"0e5725d","metric":61.329,"metrics":{"pane_median":34.087,"pane_max":61.329,"idle_pane_p95":35.091,"active_idle_pane_gap":26.238},"status":"discard","description":"Tried shrinking the hidden thought buffer only while drafting, from 2.4k chars down to 1.6k, while leaving the non-drafting limit unchanged.","timestamp":1774406293799,"segment":4,"confidence":null,"asi":{"hypothesis":"A more aggressive hidden-buffer cap only during active drafting might cut thought-string churn further without affecting non-drafting observation.","learned":"This produced another large pane-p95 spike, so the earlier 2.4k buffer limit remains the safer setting even when applied during drafting bursts.","rollback_reason":"Primary metric regressed from 33.41 ms to 61.33 ms.","next_action_hint":"Keep the simple 2.4k buffer limit and avoid more hidden-buffer tuning on the noisy tmux benchmark unless a larger, clearly beneficial effect appears.","candidate":"dynamic drafting thought buffer limit 1600"}}
{"run":47,"commit":"0e5725d","metric":61.55,"metrics":{"pane_median":32.042,"pane_max":61.55,"idle_pane_p95":33.893,"active_idle_pane_gap":27.658},"status":"discard","description":"Moved live thought updates out of the scrolling chat container into a dedicated viewport widget, while still persisting the final thought panel into chat history at request end.","timestamp":1774406420634,"segment":4,"confidence":null,"asi":{"hypothesis":"Detaching live thought updates from chat history during the request might remove mount/layout churn that still affects visible draft responsiveness.","learned":"On the restored tmux benchmark this still produced large pane-p95 spikes, so live-chat-container churn is not the only or main source of the remaining tail latency.","rollback_reason":"Primary metric regressed from 33.41 ms to 61.55 ms.","next_action_hint":"Do not pursue the detached live-thinking widget path further without stronger evidence; the simpler in-chat approach remains safer.","candidate":"dedicated live thought widget outside chat container"}}
{"type":"config","name":"Active-request tmux draft visibility latency (median)","metricName":"pane_median","metricUnit":"ms","bestDirection":"lower"}
{"run":48,"commit":"0e5725d","metric":36.285,"metrics":{"pane_p95":61.952,"pane_max":61.952,"idle_pane_p95":35.071,"active_idle_pane_gap":26.881},"status":"keep","description":"Baseline for the median-focused tmux benchmark: same real tmux workload, but now optimizing the stable typical-latency signal instead of the single-sample p95 tail artifact.","timestamp":1774406665388,"segment":5,"confidence":null,"asi":{"hypothesis":"`pane_median` is a more trustworthy optimization target than `pane_p95` for the current one-token tmux benchmark because repeated no-code reruns showed p95 is dominated by polling jitter.","learned":"Current branch baseline on the median-focused target is 36.29 ms, with `pane_p95`/`pane_max` retained as tail monitors for catastrophic regressions.","benchmark_reasoning":"No-code reruns on the old target swung from ~33 ms to ~60 ms pane_p95 while medians stayed much steadier, so the primary metric needed to track the stable signal instead of observer noise.","previous_findings":"The 150 ms recent-keypress deferral remains the stable live-thought compromise entering this phase."}}
{"run":49,"commit":"0e5725d","metric":32.01,"metrics":{"pane_p95":33.751,"pane_max":33.751,"idle_pane_p95":35.746,"active_idle_pane_gap":-1.995},"status":"keep","description":"Detached live thought updates from the scrolling chat container into a dedicated viewport widget, while still persisting the final thought panel into chat history at request end.","timestamp":1774406746702,"segment":5,"confidence":null,"asi":{"hypothesis":"Even if the old p95-focused benchmark was too noisy to trust, removing live thought updates from chat-history layout churn may still improve the common visible typing path measured by tmux median latency.","learned":"Under the median-focused tmux workload, the detached live-thinking widget produced a clear win: pane_median dropped from 36.29 ms to 32.01 ms, and the tail monitors improved too.","user_behavior_preserved":"Thoughts remain live during the request and still persist into chat history at request end; only the live rendering path moved out of chat-flow layout.","next_probe":"Re-run this detached-widget change under the median-focused benchmark to confirm the ~4 ms gain is real before trusting it."}}
{"run":50,"commit":"9a136fc","metric":33.601,"metrics":{"pane_p95":60.222,"pane_max":60.222,"idle_pane_p95":33.59,"active_idle_pane_gap":26.632},"status":"keep","description":"Confirmed the detached live-thinking widget under the median-focused tmux benchmark; the gain shrank versus the first run but still beat baseline while preserving live thoughts and final chat persistence.","timestamp":1774406811004,"segment":5,"confidence":2.686989314896289,"asi":{"hypothesis":"If moving live thought updates out of chat-flow layout is a real median improvement, it should still beat the old in-chat path on a confirmation rerun.","learned":"The rerun came back noisier than the first win but still improved the primary metric (33.60 ms vs 36.29 ms baseline), so the detached-widget approach remains worth keeping under the median-focused target.","confidence_note":"Tail monitors moved back toward baseline on rerun, so this looks like a moderate-but-real median improvement rather than a universal win across every secondary metric.","next_probe":"Now that the structural change is kept, check whether the 150 ms keypress deferral is still necessary in full under the detached-widget path."}}
{"run":51,"commit":"9a136fc","metric":34.038,"metrics":{"pane_p95":62.739,"pane_max":62.739,"idle_pane_p95":34.279,"active_idle_pane_gap":28.459},"status":"discard","description":"Tried shortening the recent-keypress thought deferral from 150 ms to 125 ms on top of the detached live-thinking widget path.","timestamp":1774406853602,"segment":5,"confidence":4.215976331360948,"asi":{"hypothesis":"After removing live thought updates from chat-flow layout, a shorter keypress grace window might recover slightly fresher thoughts without sacrificing typical draft responsiveness.","learned":"The detached-widget path still prefers the 150 ms grace window; dropping to 125 ms gave back some of the median win and worsened the tail monitors.","rollback_reason":"Primary metric regressed from the current best 33.60 ms to 34.04 ms.","next_action_hint":"Keep the detached widget plus 150 ms deferral combination and try only more orthogonal changes from here.","candidate":"detached live widget with 125 ms keypress deferral"}}
{"run":52,"commit":"bf08ce6","metric":32.891,"metrics":{"pane_p95":34.88,"pane_max":34.88,"idle_pane_p95":33.8,"active_idle_pane_gap":1.08},"status":"keep","description":"Lowered the drafting-time thought throttle from 300 ms to 250 ms on top of the detached live-thinking widget path.","timestamp":1774406903986,"segment":5,"confidence":6.021126760563371,"asi":{"hypothesis":"Once live thought updates no longer churn chat layout, the drafting-time throttle may be able to relax from 300 ms to 250 ms without hurting typical typing responsiveness.","learned":"Under the median-focused tmux benchmark, 250 ms was clearly better than 300 ms with the detached-widget path: pane_median dropped to 32.89 ms and the tail monitors improved dramatically.","product_tradeoff":"Thoughts still defer briefly during active drafting, but now resume a bit sooner than before while keeping the improved detached live widget architecture.","next_probe":"Re-run the 250 ms detached-widget configuration to confirm the gain is real, then test whether 200 ms is now viable too."}}
{"run":53,"commit":"bf08ce6","metric":33.083,"metrics":{"pane_p95":33.832,"pane_max":33.832,"idle_pane_p95":63.007,"active_idle_pane_gap":-29.175},"status":"discard","description":"Confirmation rerun of the detached-widget + 250 ms drafting-throttle configuration to measure noise after the first clear win.","timestamp":1774406937553,"segment":5,"confidence":7.454228421970365,"asi":{"hypothesis":"If the 250 ms detached-widget configuration is a real improvement, a confirmation rerun should remain near the first win even if the exact number moves with tmux noise.","learned":"The rerun stayed better than the old 300 ms baseline but not as strong as the first result, so the improvement looks real but smaller than the headline first-run number.","rollback_reason":"No code change; this rerun was used to measure noise around the kept 250 ms configuration and came back slightly worse than the current best sample.","next_action_hint":"Keep the committed 250 ms configuration, treat the median gain as moderate rather than huge, and test only clearly different settings from here.","experiment_type":"noise check rerun on detached-widget 250 ms config"}}
{"run":54,"commit":"bf08ce6","metric":33.263,"metrics":{"pane_p95":60.073,"pane_max":60.073,"idle_pane_p95":35.618,"active_idle_pane_gap":24.456},"status":"discard","description":"Tried lowering the drafting-time thought throttle further from 250 ms to 200 ms on top of the detached live-thinking widget path.","timestamp":1774406975001,"segment":5,"confidence":11.491935483870968,"asi":{"hypothesis":"With the detached live-thinking widget in place, 200 ms might now be viable and recover even fresher thought updates without hurting typical draft responsiveness.","learned":"200 ms gave back part of the median gain and brought back large tail spikes, so 250 ms remains the better setting on top of the detached widget path.","rollback_reason":"Primary metric regressed from the current best 32.89 ms to 33.26 ms.","next_action_hint":"Keep 250 ms as the drafting throttle for the detached-widget architecture; if tuning continues, try a slightly slower setting rather than faster.","candidate":"detached live widget with 200 ms drafting throttle"}}
