{"run":22,"commit":"06a5a41","metric":145.217,"metrics":{"input_median":103.387,"input_max":176.185,"idle_p95":82.218,"active_idle_gap":62.999},"status":"discard","description":"Tried relaxing the coarse drafting-time thought throttle from 300 ms back down to 200 ms while keeping the new 150 ms recent-keypress deferral in place.","timestamp":1774403552870,"segment":0,"confidence":22.30569274759539,"asi":{"hypothesis":"The short recent-keypress deferral may carry most of the responsiveness win, allowing fresher between-burst thought updates with a milder drafting throttle.","learned":"The 300 ms drafting throttle is still doing major work even after adding recent-keypress deferral; dropping it to 200 ms caused a large regression.","rollback_reason":"Primary metric regressed badly from 124.18 ms to 145.22 ms.","next_action_hint":"Keep the 300 ms drafting throttle as a necessary companion to the 150 ms recent-keypress grace window.","candidate":"drafting throttle 200 ms with 150 ms recent-keypress defer"}}
{"run":23,"commit":"06a5a41","metric":129.199,"metrics":{"input_median":94.748,"input_max":151.654,"idle_p95":65.638,"active_idle_gap":63.561},"status":"discard","description":"Tried strengthening the coarse drafting-time thought throttle from 300 ms to 350 ms while keeping the 150 ms recent-keypress grace window.","timestamp":1774403610938,"segment":0,"confidence":21.83460559796433,"asi":{"hypothesis":"A slightly stronger between-burst drafting throttle might complement the recent-keypress deferral and shave off a bit more contention.","learned":"350 ms regressed, so the current 300 ms drafting throttle remains the better balance even with the added keypress grace window.","rollback_reason":"Primary metric regressed from 124.18 ms to 129.20 ms.","next_action_hint":"Keep the 300 ms drafting throttle; further gains likely need a different mechanism than more cadence tuning.","candidate":"drafting throttle 350 ms with 150 ms recent-keypress defer"}}
{"run":24,"commit":"06a5a41","metric":127.789,"metrics":{"input_median":103.807,"input_max":140.947,"idle_p95":67.019,"active_idle_gap":60.77},"status":"discard","description":"Tried short-circuiting thought refresh attempts directly in thinking_callback() during recent typing bursts when a panel already exists, instead of entering refresh_thinking_output() just to defer there.","timestamp":1774403693000,"segment":0,"confidence":21.879143294237565,"asi":{"hypothesis":"The current recent-keypress deferral still pays some avoidable function/clock-check overhead on each queued thought chunk; an earlier short-circuit might preserve the win and shave a bit more work.","learned":"This regressed, so the extra early return likely interfered with useful timing/state flow more than it saved in overhead.","rollback_reason":"Primary metric regressed from 124.18 ms to 127.79 ms.","next_action_hint":"Keep the existing deferral only inside refresh_thinking_output and avoid over-optimizing that path without direct profiling.","candidate":"early thinking_callback short-circuit during recent typing"}}
{"run":25,"commit":"06a5a41","metric":124.904,"metrics":{"input_median":103.488,"input_max":148.614,"idle_p95":65.4,"active_idle_gap":59.503},"status":"discard","description":"Tried lowering the hidden thought-buffer limit from 2.4k chars to 2.0k chars on top of the current recent-keypress grace window.","timestamp":1774403818133,"segment":0,"confidence":21.83460559796433,"asi":{"hypothesis":"With the newer typing-burst deferral in place, a slightly smaller hidden thought buffer might cut hidden-string churn further without hurting visible output.","learned":"The 2.0k buffer regressed slightly versus 2.4k, so the earlier 2.4k limit still looks like the better operating point even with the newer keypress deferral.","rollback_reason":"Primary metric regressed from 124.18 ms to 124.90 ms.","next_action_hint":"Keep the 2.4k hidden buffer and only revisit this if a more representative benchmark points at hidden-string churn again.","candidate":"thinking buffer 2000 chars with recent-keypress defer"}}
{"run":26,"commit":"06a5a41","metric":126.721,"metrics":{"input_median":103.587,"input_max":127.233,"idle_p95":83.523,"active_idle_gap":43.198},"status":"discard","description":"Tried reducing the visible thought panel from 10 lines to 8 lines to cut live render payload without removing the panel entirely.","timestamp":1774403907603,"segment":0,"confidence":22.30569274759539,"asi":{"hypothesis":"A modestly smaller live thought panel might reduce render work enough to help typing responsiveness while still keeping thoughts visible.","learned":"Even though the active-idle gap narrowed, the primary p95 regressed substantially because idle baseline also worsened; the smaller panel is not a win on the chosen metric.","rollback_reason":"Primary metric regressed from 124.18 ms to 126.72 ms.","next_action_hint":"Keep the 10-line panel and only revisit visible payload size if a more user-facing benchmark says smaller live thought context is acceptable.","candidate":"thinking panel max lines 8"}}
{"run":27,"commit":"06a5a41","metric":125.749,"metrics":{"input_median":103.911,"input_max":145.565,"idle_p95":65.024,"active_idle_gap":60.725},"status":"discard","description":"Tried using a lighter-weight plain-string live thought render path while keeping the styled Rich panel rendering for the final persisted thought panel.","timestamp":1774404027162,"segment":0,"confidence":22.797555791710877,"asi":{"hypothesis":"Per-update Rich `Text` construction may still be a measurable part of live thought-panel cost; a plain-string live path could preserve visuals via CSS with less overhead.","learned":"This regressed, so Rich `Text` object construction is not the dominant remaining cost in the live path.","rollback_reason":"Primary metric regressed from 124.18 ms to 125.75 ms.","next_action_hint":"Keep the simpler existing render path and avoid splitting live/final thought rendering without stronger profiling evidence.","candidate":"plain-string live thought rendering path"}}
{"type":"config","name":"Active-request input paint latency","metricName":"paint_p95","metricUnit":"ms","bestDirection":"lower"}
{"run":28,"commit":"06a5a41","metric":22.898,"metrics":{"paint_median":3.087,"press_return_p95":127.731,"paint_after_return_p95":0,"idle_paint_p95":3.721,"active_idle_paint_gap":19.177},"status":"keep","description":"Baseline for the new keypress-to-render benchmark: current branch state measured against editor paint latency rather than coarse pilot.press wall time.","timestamp":1774404219112,"segment":1,"confidence":null,"asi":{"hypothesis":"Switch to a more user-facing benchmark before continuing tuning, so further changes target visible local typing latency instead of only tool-harness wall time.","learned":"On the current best branch state, editor paint p95 is already much lower than pilot.press wall time (22.9 ms vs 127.7 ms), which suggests the user pain may live in burst stalls/outliers or in phenomena the old coarse benchmark hid.","benchmark_change":"Primary metric now records time until Editor.render_line runs with the updated value.","previous_best_context":"Branch already contains earlier wins: scroll_end removal, adaptive drafting throttle, smaller hidden thought buffer, and 150 ms recent-keypress deferral."}}
{"run":29,"commit":"d91836a","metric":22.04,"metrics":{"paint_median":3.077,"press_return_p95":126.425,"paint_after_return_p95":0,"idle_paint_p95":4.078,"active_idle_paint_gap":17.961},"status":"keep","description":"Re-ran the new keypress-to-render baseline after fixing benchmark script hook issues; current branch state still establishes a low-20 ms paint-latency baseline for the render-focused workload.","timestamp":1774404320259,"segment":1,"confidence":null,"asi":{"hypothesis":"The new render-focused benchmark is stable enough to use for the next optimization phase once the benchmark script lands cleanly.","learned":"The rerun improved slightly to 22.04 ms paint p95, so the current branch is a solid baseline for further paint-focused work.","reason_for_rerun":"Previous keep attempt failed to auto-commit because the new benchmark script needed executable bit + a trivial Ruff simplification.","next_probe":"Now optimize the actual paint metric itself rather than the old pilot.press wall-time proxy."}}
{"run":30,"commit":"d91836a","metric":25.264,"metrics":{"paint_median":3.149,"press_return_p95":131.432,"paint_after_return_p95":0,"idle_paint_p95":4.555,"active_idle_paint_gap":20.708},"status":"discard","description":"Removed the 150 ms recent-keypress thought deferral to see whether the newer paint-focused metric still wanted that keyburst grace window.","timestamp":1774404378855,"segment":1,"confidence":1,"asi":{"hypothesis":"The new keypress-to-render metric might expose the recent-keypress deferral as unnecessary or even harmful, since it was originally tuned against the older wall-time proxy.","learned":"The deferral clearly still helps the more user-facing paint metric; removing it regressed paint p95 from 22.04 ms to 25.26 ms.","rollback_reason":"Primary metric regressed badly from 22.04 ms to 25.26 ms.","next_action_hint":"Keep the recent-keypress deferral and optimize around it rather than questioning its existence.","candidate":"disable recent-keypress thought deferral under paint benchmark"}}
{"run":31,"commit":"d91836a","metric":23.213,"metrics":{"paint_median":3.314,"press_return_p95":125.68,"paint_after_return_p95":0,"idle_paint_p95":4.826,"active_idle_paint_gap":18.387},"status":"discard","description":"Shortened the recent-keypress thought deferral window from 150 ms to 125 ms under the paint-focused benchmark.","timestamp":1774404428838,"segment":1,"confidence":1.4629156010230122,"asi":{"hypothesis":"The paint-focused metric may prefer a slightly shorter grace window than the older wall-time proxy did.","learned":"125 ms still regressed versus 150 ms on the paint metric, so the current keyburst window remains the better setting under both benchmarks.","rollback_reason":"Primary metric regressed from 22.04 ms to 23.21 ms.","next_action_hint":"Keep the 150 ms recent-keypress deferral and search for a different paint-path lever.","candidate":"recent keypress defer 125 ms under paint benchmark"}}
{"type":"config","name":"Active-request tmux draft visibility latency","metricName":"pane_p95","metricUnit":"ms","bestDirection":"lower"}
{"run":32,"commit":"d91836a","metric":37.071,"metrics":{"pane_median":34.177,"pane_max":37.071,"idle_pane_p95":61.631,"active_idle_pane_gap":-24.56},"status":"keep","description":"Baseline for the tmux-pane visibility benchmark: current branch state measured in a real tmux session with a synthetic active request.","timestamp":1774404603799,"segment":2,"confidence":null,"asi":{"hypothesis":"Validate the current branch against the closest automated proxy to the original user complaint before making further changes.","learned":"Current branch already shows draft tokens in the tmux pane at ~37 ms p95 during an active synthetic request, which is dramatically faster than the historical ~1s+ coarse tmux observations from earlier work.","benchmark_change":"Primary metric now records real tmux pane visibility latency rather than in-process render timing or pilot.press wall time.","previous_best_context":"Branch still includes earlier kept wins from the coarser benchmarks: scroll_end removal, adaptive drafting throttle, smaller hidden thought buffer, and 150 ms recent-keypress deferral."}}
{"run":33,"commit":"87616f4","metric":35.703,"metrics":{"pane_median":33.843,"pane_max":35.703,"idle_pane_p95":35.294,"active_idle_pane_gap":0.409},"status":"keep","description":"Re-ran the tmux-pane baseline after landing the new benchmark files cleanly; current branch remains in the mid-30 ms range for real pane visibility during an active synthetic request.","timestamp":1774404661417,"segment":2,"confidence":null,"asi":{"hypothesis":"The tmux-pane benchmark is stable enough to serve as the closest user-facing gate once the harness files land cleanly.","learned":"The rerun tightened to 35.7 ms p95, reinforcing that the current branch is already very responsive by the real tmux-pane visibility proxy.","reason_for_rerun":"Previous keep attempt did not auto-commit because the new tmux benchmark files needed a clean pre-commit pass first.","next_probe":"Test whether the recent-keypress thought deferral still matters under the real tmux-pane metric, since this benchmark is now the closest proxy to the original complaint."}}
{"run":34,"commit":"87616f4","metric":63.276,"metrics":{"pane_median":35.35,"pane_max":63.276,"idle_pane_p95":35.442,"active_idle_pane_gap":27.834},"status":"discard","description":"Removed the 150 ms recent-keypress thought deferral to see whether the real tmux-pane metric still required that typing-burst grace window.","timestamp":1774404704230,"segment":2,"confidence":1,"asi":{"hypothesis":"The closest user-facing tmux metric might show the recent-keypress deferral is unnecessary even if earlier in-process benchmarks liked it.","learned":"The tmux workload regressed sharply without the keypress grace window, so the deferral is a real contributor to visible draft responsiveness in the terminal too.","rollback_reason":"Primary metric regressed badly from 35.70 ms to 63.28 ms.","next_action_hint":"Keep the 150 ms keypress deferral and test only bounded variants around it if further tuning is needed.","candidate":"disable recent-keypress thought deferral under tmux benchmark"}}
{"run":35,"commit":"74cf901","metric":35.11,"metrics":{"pane_median":34.156,"pane_max":35.11,"idle_pane_p95":36.245,"active_idle_pane_gap":-1.135},"status":"keep","description":"Shortened the recent-keypress thought deferral window from 150 ms to 125 ms under the real tmux-pane benchmark.","timestamp":1774404745206,"segment":2,"confidence":2,"asi":{"hypothesis":"The real tmux-pane metric may prefer a slightly shorter typing-burst grace window than the earlier in-process benchmarks did.","learned":"On the tmux-pane workload, 125 ms slightly beat 150 ms and eliminated the active-vs-idle gap, suggesting the shorter grace window may preserve responsiveness while letting thought updates resume sooner.","tradeoff":"Thought updates still defer during brief active typing bursts, but for less time than the previous 150 ms setting.","next_probe":"Re-run the 125 ms window to see whether the sub-millisecond p95 gain over 150 ms survives tmux benchmark noise."}}
{"run":36,"commit":"74cf901","metric":63.678,"metrics":{"pane_median":34.174,"pane_max":63.678,"idle_pane_p95":36.112,"active_idle_pane_gap":27.566},"status":"discard","description":"Re-ran the 125 ms recent-keypress deferral under the tmux benchmark to verify the small apparent win over 150 ms.","timestamp":1774404772915,"segment":2,"confidence":1,"asi":{"hypothesis":"If 125 ms is a real improvement over 150 ms, a confirmation run should stay near the new best rather than producing active-request pane spikes.","learned":"The rerun produced a large active pane p95 spike (~63.7 ms) with the same code, so the apparent 125 ms win was not stable enough to trust on this benchmark.","rollback_reason":"The confirmation run regressed badly versus both the previous 150 ms setting and the first 125 ms run, indicating tmux-benchmark noise or a real tail-latency problem.","next_action_hint":"Revert to the stable 150 ms window and, if further tmux tuning is attempted, increase repetitions or change the statistic so one noisy sample does not mislead the loop.","candidate":"recent keypress defer 125 ms tmux confirmation"}}
{"run":37,"commit":"0e5725d","metric":37.275,"metrics":{"pane_median":33.733,"pane_max":37.275,"idle_pane_p95":34.771,"active_idle_pane_gap":2.504},"status":"keep","description":"Restored the recent-keypress thought deferral to 150 ms after the 125 ms setting proved tail-unstable under tmux; this lands the more stable window even though this single rerun is within noise of the original 150 ms baseline.","timestamp":1774404848670,"segment":2,"confidence":1.1101047268610233,"asi":{"hypothesis":"The earlier 125 ms tmux win may have been a noisy false positive; restoring 150 ms should trade a tiny amount of nominal p95 for better tail stability.","learned":"A follow-up tmux run at 150 ms came in essentially on top of the original baseline, while the 125 ms confirmation showed severe pane-p95/pane-max spikes; 150 ms is the safer stable setting.","why_keep_despite_metric":"This rerun is only +0.20 ms over the tmux baseline and is within expected noise, whereas the committed 125 ms variant showed a catastrophic 63.7 ms tail spike on confirmation.","next_probe":"If further tmux tuning is attempted, increase repeats or use a more tail-robust statistic before trusting sub-millisecond wins."}}
{"run":38,"commit":"0e5725d","metric":60.026,"metrics":{"pane_median":34.138,"pane_max":60.026,"idle_pane_p95":34.317,"active_idle_pane_gap":25.709},"status":"checks_failed","description":"Tried keying the recent-thought deferral timestamp off actual editor value changes instead of raw edit key events.","timestamp":1774405069520,"segment":2,"confidence":0.9057736720554269,"asi":{"hypothesis":"Tracking actual editor mutations instead of edit-key intent might resume thought updates sooner without hurting real draft responsiveness.","learned":"The tmux benchmark regressed badly (~60 ms p95), so the slightly later mutation-based timestamping was worse than the earlier key-event-based signal.","rollback_reason":"New focused tests were written incorrectly against a plain stub, and the primary metric regressed sharply anyway.","next_action_hint":"Discard mutation-time tracking and keep the earlier keypress-time signal; if revisiting this idea, test the helper directly rather than calling watch_value on a stub that lacks editor methods.","failure_detail":"tests/unit/ui/test_editor_activity.py stub lacked _record_edit_activity method"}}
{"type":"config","name":"Active-request tmux draft visibility latency (multi-token)","metricName":"pane_p95","metricUnit":"ms","bestDirection":"lower"}
{"run":39,"commit":"0e5725d","metric":0,"metrics":{},"status":"crash","description":"Switched the tmux benchmark to a more tail-stable multi-token-per-session workload, but the first baseline attempt timed out with the current repeat/token counts.","timestamp":1774405345017,"segment":3,"confidence":null,"asi":{"hypothesis":"A multi-token tmux workload should reduce noise and prevent false positives from one-token pane spikes.","learned":"The first stab was too expensive for the current timeout budget; the benchmark needs fewer repeats/tokens per run or a longer timeout before it can guide optimization.","rollback_reason":"run_experiment timed out at ~174s before producing a metric.","next_action_hint":"Keep the multi-token structure but trim the default token count/repeats enough to finish comfortably under the benchmark timeout.","failure_mode":"timeout in ./autoresearch.sh after changing tmux workload to multi-token sessions"}}
{"run":40,"commit":"0e5725d","metric":33.441,"metrics":{"pane_median":32.441,"pane_max":33.441,"idle_pane_p95":58.911,"active_idle_pane_gap":-25.47},"status":"keep","description":"Baseline for the stabilized multi-token tmux benchmark: per-session p95 is now computed across several draft tokens in the same active request, reducing false positives from one noisy token.","timestamp":1774405474920,"segment":3,"confidence":null,"asi":{"hypothesis":"Measuring multiple draft tokens per tmux session will produce a more trustworthy user-facing signal than the earlier one-token-per-session benchmark.","learned":"The lighter multi-token workload completes quickly and establishes a tighter baseline at 33.44 ms pane p95, giving the loop a less noisy target for further experiments.","benchmark_shape":"3 repeats, 4 draft tokens per session, median of per-session p95s.","why_changed":"The prior one-token tmux benchmark produced a false-positive 125 ms keypress-deferral win that failed on confirmation, so benchmark stability became necessary before trusting tiny improvements."}}
{"run":41,"commit":"0e5725d","metric":61.775,"metrics":{"pane_median":33.523,"pane_max":61.775,"idle_pane_p95":35.775,"active_idle_pane_gap":26},"status":"discard","description":"Re-ran the lighter multi-token tmux benchmark to verify it was more stable than the one-token version; it still produced a large pane-p95 spike.","timestamp":1774405540731,"segment":3,"confidence":null,"asi":{"hypothesis":"A 3-repeat, 4-token-per-session tmux workload would be stable enough to avoid the false positives seen with one-token sessions.","learned":"The confirmation run still spiked to ~61.8 ms p95, so this lighter multi-token variant is not yet trustworthy enough to replace the simpler tmux benchmark.","rollback_reason":"Benchmark redesign failed its own stability test: second run regressed badly from 33.4 ms to 61.8 ms with no app code changes.","next_action_hint":"Discard this benchmark variant for now; either stick with the original tmux benchmark or redesign stability improvements more carefully before changing targets again.","candidate":"multi-token tmux benchmark 3 repeats x 4 tokens"}}
