{"type":"config","name":"Active-request input latency","metricName":"input_p95","metricUnit":"ms","bestDirection":"lower"}
{"run":1,"commit":"fb0b674","metric":166.546,"metrics":{"input_median":103.879,"input_max":209.564,"idle_p95":83.74,"active_idle_gap":82.806},"status":"keep","description":"Baseline benchmark + focused checks for active-request input latency; benchmark uses synthetic live-thinking churn through the real Textual app.","timestamp":1774401349763,"segment":0,"confidence":null,"asi":{"hypothesis":"Establish a representative baseline before touching live thought rendering.","learned":"Synthetic active-thinking load produces a clear active-vs-idle gap (~82.8 ms) with p95 latency at 166.5 ms, so the benchmark is sensitive enough to guide UI-churn optimizations.","benchmark_shape":"pilot.press() latency during an active request with real app lifecycle and focused UI checks enabled."}}
{"run":2,"commit":"fb0b674","metric":146.393,"metrics":{"input_median":103.52,"input_max":168.782,"idle_p95":65.639,"active_idle_gap":80.754},"status":"keep","description":"Removed forced chat scroll_end() on incremental thought-panel updates so live thought refreshes stop driving viewport scrolling on every tick.","timestamp":1774401418199,"segment":0,"confidence":null,"asi":{"hypothesis":"The remaining latency is partly caused by the thinking panel forcing a viewport scroll on every incremental update.","learned":"In the synthetic active-thinking workload, removing scroll_end() reduced input_p95 from 166.5 ms to 146.4 ms and cut spike severity, so viewport-scroll churn is still a meaningful contributor even after request threading.","code_path":"src/tunacode/ui/thinking_state.py refresh_thinking_output update path","user_behavior_preserved":"Live thought updates still render; only the incremental forced scroll was removed."}}
{"run":3,"commit":"fb0b674","metric":146.904,"metrics":{"input_median":103.484,"input_max":147.759,"idle_p95":66.302,"active_idle_gap":80.602},"status":"discard","description":"Detached the live thinking panel from chat history into a dedicated viewport widget so incremental thought updates no longer mutate chat children during an active request.","timestamp":1774401646312,"segment":0,"confidence":39.438356164383876,"asi":{"hypothesis":"Moving live thought updates out of ChatContainer entirely will reduce layout/mount churn beyond the scroll_end removal.","learned":"This architectural shift produced essentially no further p95 improvement beyond the simpler scroll_end removal, so the expensive path is likely render/update cost itself rather than child insertion bookkeeping.","rollback_reason":"input_p95 regressed slightly versus the current best (146.9 ms vs 146.4 ms) for substantially more complexity.","next_action_hint":"Try reducing how often the live thinking Text widget is regenerated, or decouple editor visibility from frequent viewport sibling updates with a cheaper text-only update path.","experiment_type":"live thinking widget detached from chat history"}}
{"run":4,"commit":"fb0b674","metric":128.254,"metrics":{"input_median":103.892,"input_max":145.947,"idle_p95":65.746,"active_idle_gap":62.508},"status":"keep","description":"Coarsened live thought-panel refresh cadence from 100 ms to 200 ms, reducing active-request UI churn while preserving visible streaming thoughts.","timestamp":1774401721341,"segment":0,"confidence":4.106380697050931,"asi":{"hypothesis":"The remaining input lag is dominated by too-frequent live thought re-renders; a slightly coarser cadence may preserve the feature while reducing contention.","learned":"Doubling thought throttle to 200 ms improved input_p95 to 128.3 ms and shrank the active-vs-idle gap to 62.5 ms, indicating update frequency is a major lever and a 200 ms cadence still keeps live thought updates present.","tradeoff":"Thoughts remain live but refresh less often; this is a product tradeoff rather than a hidden/deferred rendering hack.","next_probe":"Measure whether 150 ms captures most of the gain with fresher thought updates, or whether adaptive throttling based on editor activity can do even better."}}
{"run":5,"commit":"24b5efb","metric":126.993,"metrics":{"input_median":103.444,"input_max":127.8,"idle_p95":65.415,"active_idle_gap":61.578},"status":"keep","description":"Re-ran the 200 ms thought refresh cadence after fixing benchmark lint so the improvement can land cleanly with passing hooks.","timestamp":1774401801375,"segment":0,"confidence":2.180550195710898,"asi":{"hypothesis":"The previously measured 200 ms thought cadence win is real; rerunning after trivial benchmark lint cleanup should confirm it and allow a clean keep.","learned":"The win reproduced and slightly improved (126.99 ms p95), so the reduced-thought-refresh-cadence change is stable enough to keep.","reason_for_rerun":"Previous keep attempts failed due a trivial unused benchmark variable, not due product-code checks.","next_probe":"Now that a stable improvement is secured, explore whether adaptive cadence keyed to active editor drafting can reduce p95 further without making thoughts uniformly less fresh."}}
{"run":6,"commit":"08acfba","metric":126.148,"metrics":{"input_median":103.384,"input_max":164.691,"idle_p95":65.872,"active_idle_gap":60.275},"status":"keep","description":"Made thought refresh cadence adaptive: 100 ms normally, 300 ms only while the editor contains an in-progress draft, preserving fresher thoughts when idle while easing typing-time churn.","timestamp":1774401924389,"segment":0,"confidence":4.057857465722464,"asi":{"hypothesis":"The best tradeoff may be to slow live thought refreshes only during active drafting rather than all the time.","learned":"Adaptive throttling matched/slightly beat the constant-200 ms result (126.15 ms p95) while restoring faster thought updates whenever the user is not typing a draft.","product_tradeoff":"Thought visibility stays live; only drafting periods use the slower 300 ms cadence, so non-drafting request observation stays at the original 100 ms cadence.","next_probe":"Try a milder drafting cadence (250 ms) or detect actual recent key activity instead of any non-empty editor value to reduce over-throttling after the user pauses."}}
{"run":7,"commit":"08acfba","metric":126.918,"metrics":{"input_median":103.372,"input_max":167.1,"idle_p95":65.754,"active_idle_gap":61.164},"status":"discard","description":"Tried a milder adaptive drafting throttle (250 ms instead of 300 ms) to recover slightly fresher live thoughts while keeping the adaptive behavior.","timestamp":1774401982073,"segment":0,"confidence":19.18233618233623,"asi":{"hypothesis":"250 ms while drafting may preserve most of the latency win with fresher thought updates than 300 ms.","learned":"The 250 ms drafting throttle gave back part of the p95 gain versus 300 ms, so 300 ms remains the better responsiveness/freshness tradeoff under this workload.","rollback_reason":"Primary metric regressed from 126.15 ms to 126.92 ms with no compensating benefit in the measured workload.","next_action_hint":"Keep the 300 ms drafting throttle and explore reducing rerender cost or making the throttle depend on recent key activity rather than any non-empty editor text.","candidate":"adaptive drafting throttle 250 ms"}}
{"run":8,"commit":"5246df8","metric":124.718,"metrics":{"input_median":103.554,"input_max":128.877,"idle_p95":66.157,"active_idle_gap":58.561},"status":"keep","description":"Reduced the internal thinking-text buffer from 20k chars to 2.4k chars so live thought updates stop repeatedly copying far more hidden history than the UI can render.","timestamp":1774402042560,"segment":0,"confidence":19.095183748002796,"asi":{"hypothesis":"A large hidden thought buffer is wasting time on string growth/copying, because the UI only ever renders the last ~1200 chars anyway.","learned":"Cutting the hidden buffer to 2.4k chars improved input_p95 to 124.7 ms and further reduced the active-idle gap, confirming that invisible thought-history retention was contributing measurable churn.","behavior_preserved":"Visible thought output is unchanged because the renderer already truncates to 1200 chars with hidden-content markers.","next_probe":"Try matching the buffer directly to the visible render budget, or reduce needless re-renders by skipping updates when the rendered panel text is unchanged."}}
{"run":9,"commit":"5246df8","metric":127.018,"metrics":{"input_median":103.748,"input_max":154.943,"idle_p95":66.457,"active_idle_gap":60.561},"status":"discard","description":"Tried shrinking the hidden thought buffer all the way down to the visible 1200-char render budget.","timestamp":1774402089558,"segment":0,"confidence":33.84142394822033,"asi":{"hypothesis":"If 2.4k hidden chars helped, matching the buffer exactly to the 1200-char visible budget might cut copy cost further.","learned":"The 1200-char buffer regressed versus 2.4k, suggesting a little extra headroom helps avoid pathological churn from constant exact-limit trimming.","rollback_reason":"Primary metric regressed from 124.72 ms to 127.02 ms.","next_action_hint":"Keep the 2.4k buffer and explore caching/render-diff approaches instead of more aggressive truncation.","candidate":"thinking buffer 1200 chars"}}
{"run":10,"commit":"5246df8","metric":128.067,"metrics":{"input_median":103.519,"input_max":148.018,"idle_p95":65.751,"active_idle_gap":62.316},"status":"discard","description":"Tried shrinking the live thought panel's visible char budget to 800 while drafting, while keeping the fuller 1200-char panel on finalize.","timestamp":1774402178123,"segment":0,"confidence":39.72269705603048,"asi":{"hypothesis":"Reducing the amount of visible thought text rendered during active drafting might cut rerender cost without hiding live thoughts entirely.","learned":"This regressed the primary metric, so render-frequency/buffer-size changes matter more here than the visible char budget itself.","rollback_reason":"input_p95 worsened from 124.72 ms to 128.07 ms.","next_action_hint":"Keep the existing visible budget and look for cheaper editor-aware throttling or render-skipping heuristics instead of shrinking the live panel payload.","candidate":"drafting live thought max chars 800"}}
{"run":11,"commit":"5246df8","metric":124.967,"metrics":{"input_median":103.309,"input_max":146.545,"idle_p95":65.559,"active_idle_gap":59.407},"status":"discard","description":"Tried a stronger adaptive drafting throttle of 400 ms to see whether even fewer live thought refreshes would materially improve typing responsiveness.","timestamp":1774402230605,"segment":0,"confidence":33.84142394822033,"asi":{"hypothesis":"If 300 ms while drafting helped, 400 ms might buy a bit more typing responsiveness without fully hiding thoughts.","learned":"400 ms was slightly worse than the 300 ms drafting throttle once the smaller hidden buffer was in place, so the current optimum appears to be near 300 ms rather than simply 'slower is better'.","rollback_reason":"Primary metric regressed from 124.72 ms to 124.97 ms.","next_action_hint":"Keep the 300 ms drafting cadence and focus on reducing per-refresh work rather than slowing refreshes further.","candidate":"drafting throttle 400 ms"}}
{"run":12,"commit":"5246df8","metric":125.715,"metrics":{"input_median":102.919,"input_max":145.144,"idle_p95":66.097,"active_idle_gap":59.618},"status":"discard","description":"Reworked the hidden thought buffer from a single growing string into trimmed chunk storage, joining only on render.","timestamp":1774402350549,"segment":0,"confidence":32.94840488381268,"asi":{"hypothesis":"Repeated string concatenation on every thought delta may still be expensive; chunk accumulation with throttled joins could reduce per-delta work.","learned":"The chunk-buffer approach regressed slightly, so the added bookkeeping/join cost outweighed the saved concatenation under this workload.","rollback_reason":"Primary metric regressed from 124.72 ms to 125.72 ms.","next_action_hint":"Stick with the simpler bounded-string buffer and focus on lighter-weight editor-side heuristics or direct profiling of Textual input/render timings.","candidate":"thinking chunk deque buffer"}}
{"run":13,"commit":"5246df8","metric":145.533,"metrics":{"input_median":103.702,"input_max":166.394,"idle_p95":65.68,"active_idle_gap":79.853},"status":"checks_failed","description":"Tried deferring queued thought-delta draining until the live thought throttle window opens, so suppressed refresh windows also skip intermediate buffer concatenation work.","timestamp":1774402654904,"segment":0,"confidence":32.10130468150428,"asi":{"hypothesis":"Even with adaptive render throttling, draining and appending thought deltas every 100 ms may still waste work; only drain when a render would be allowed.","learned":"The idea benchmarked much worse than the current best (145.5 ms p95), so the extra queue retention likely hurt more than it helped even before correctness fixes.","rollback_reason":"Focused UI tests failed due to missing time import in new tests, and the primary metric regressed badly anyway.","next_action_hint":"Discard this queue-drain deferral path and look for lower-risk wins in measuring or responding to actual recent key activity instead of changing delta delivery semantics.","failure_detail":"tests/unit/ui/test_request_threading.py missing time import in new throttle tests"}}
{"run":14,"commit":"5246df8","metric":126.112,"metrics":{"input_median":103.265,"input_max":145.59,"idle_p95":67.099,"active_idle_gap":59.013},"status":"discard","description":"Skipped Editor.scroll_to_region() when the cursor is already within the visible editor viewport, to avoid redundant per-keystroke scroll work.","timestamp":1774402775751,"segment":0,"confidence":32.94840488381268,"asi":{"hypothesis":"Editor-side scroll bookkeeping may still be adding input latency on every keypress even when no scroll is needed.","learned":"This slightly regressed versus the current best, suggesting redundant vertical scrolling is not the dominant remaining cost under the active-thinking workload.","rollback_reason":"Primary metric worsened from 124.72 ms to 126.11 ms.","next_action_hint":"Keep the simpler editor path and look for thought-render costs or benchmark improvements that capture true local typing pain more directly.","candidate":"skip redundant editor scroll_to_region"}}
{"run":15,"commit":"5246df8","metric":126.932,"metrics":{"input_median":103.36,"input_max":168.058,"idle_p95":66.199,"active_idle_gap":60.733},"status":"discard","description":"Tried amortizing hidden thought-buffer trimming by letting the buffer grow to 3.2k chars before snapping back to the 2.4k steady-state limit.","timestamp":1774402881607,"segment":0,"confidence":33.1704996034894,"asi":{"hypothesis":"The current 2.4k cap may cause repeated slice/copy work on every thought append; trimming less often could keep the same visible behavior more cheaply.","learned":"This regressed, implying the slightly larger average hidden buffer cost more than the reduced trim frequency saved.","rollback_reason":"Primary metric worsened from 124.72 ms to 126.93 ms.","next_action_hint":"Keep eager 2.4k trimming and explore render-path improvements rather than looser hidden-buffer retention.","candidate":"buffer trim trigger 3200 with 2400 steady limit"}}
{"run":16,"commit":"5246df8","metric":126.6,"metrics":{"input_median":103.615,"input_max":162.439,"idle_p95":66.472,"active_idle_gap":60.129},"status":"checks_failed","description":"Tried increasing the shared flush/stream throttle from 100 ms to 150 ms so the UI wakes less often for streaming/thinking work overall.","timestamp":1774402940528,"segment":0,"confidence":35.56802721088429,"asi":{"hypothesis":"The remaining latency may partly come from the 100 ms flush cadence itself, not just thought-panel rendering, so a modestly slower global UI delta cadence could help.","learned":"Benchmark result stayed worse than the current best, so simply slowing the shared delta timer is not a win under this workload.","rollback_reason":"Checks failed because autoresearch.checks.sh still referenced a reverted temporary test file, and the primary metric was not an improvement anyway.","next_action_hint":"Restore the checks list to existing focused tests, then keep looking for targeted thought-path wins rather than broader global throttle changes.","failure_detail":"autoresearch.checks.sh referenced missing tests/unit/ui/test_thinking_state.py after revert"}}
{"run":17,"commit":"5246df8","metric":123.641,"metrics":{"input_median":103.057,"input_max":126.58,"idle_p95":65.734,"active_idle_gap":57.907},"status":"keep","description":"Deferred incremental thought-panel refreshes for 150 ms after the user's most recent editing keypress, so brief typing bursts stay locally responsive while thoughts catch up as soon as typing pauses.","timestamp":1774403158333,"segment":0,"confidence":35.2547247329499,"asi":{"hypothesis":"The user-visible pain is concentrated during active typing bursts, so a short post-keypress grace window may help more than a coarser always-on thought cadence.","learned":"A 150 ms recent-keypress deferral beat the prior best, improving input_p95 to 123.64 ms and reducing the active-idle gap to 57.9 ms while still allowing the thought panel to render initially and resume after short pauses.","product_tradeoff":"Unlike the earlier rejected 'defer while drafting' experiment, this only suppresses incremental updates during active key bursts; non-typing observation still gets live thought updates.","next_probe":"Re-run this same change to confirm the sub-1 ms gain over the prior best is real, then consider tuning the defer window slightly if it holds."}}
{"run":18,"commit":"06a5a41","metric":124.176,"metrics":{"input_median":94.727,"input_max":146.775,"idle_p95":67.617,"active_idle_gap":56.559},"status":"keep","description":"Re-ran the 150 ms recent-keypress thought deferral after formatting/hooks cleanup; the typing-burst grace window still beats the previous best and now lands with a clean validation path.","timestamp":1774403224748,"segment":0,"confidence":33.796770382040336,"asi":{"hypothesis":"The recent-keypress deferral win is real enough to survive a confirmation rerun after hook cleanup.","learned":"The rerun stayed better than the pre-change best (124.18 ms vs 124.72 ms), confirming the short typing-burst grace window is a defensible improvement even if the exact peak gain varies run to run.","reason_for_rerun":"Previous keep attempt did not auto-commit cleanly despite passing benchmark/checks, so rerunning both validated the change and retried the keep path.","next_probe":"Tune the defer window slightly around 150 ms to see whether 125 ms preserves more thought freshness without giving back the responsiveness gain."}}
{"run":19,"commit":"06a5a41","metric":124.456,"metrics":{"input_median":103.217,"input_max":145.001,"idle_p95":66.325,"active_idle_gap":58.131},"status":"discard","description":"Tried shortening the recent-keypress thought deferral window from 150 ms to 125 ms to recover slightly fresher live thoughts during short pauses.","timestamp":1774403295976,"segment":0,"confidence":32.1145209580842,"asi":{"hypothesis":"A slightly shorter grace window may preserve most of the typing-burst responsiveness gain while letting live thoughts resume sooner.","learned":"125 ms gave back some of the p95 improvement, so the current sweet spot appears closer to 150 ms than 125 ms for this workload.","rollback_reason":"Primary metric regressed from 124.18 ms to 124.46 ms.","next_action_hint":"Keep the 150 ms grace window and try a slightly longer window or more precise recent-typing detection only if it clearly improves responsiveness without hiding thoughts too long.","candidate":"recent keypress defer 125 ms"}}
{"run":20,"commit":"06a5a41","metric":125.036,"metrics":{"input_median":102.638,"input_max":145.117,"idle_p95":65.51,"active_idle_gap":59.527},"status":"discard","description":"Tried lengthening the recent-keypress thought deferral window from 150 ms to 175 ms to see whether a bit more burst protection would help typing responsiveness further.","timestamp":1774403345520,"segment":0,"confidence":26.665630826600452,"asi":{"hypothesis":"A slightly longer burst grace window might shave a bit more p95 latency while still resuming thoughts quickly after the user pauses.","learned":"175 ms regressed versus the 150 ms setting, so the keyburst deferral optimum appears fairly tight rather than simply 'longer is better'.","rollback_reason":"Primary metric regressed from 124.18 ms to 125.04 ms.","next_action_hint":"Keep the 150 ms defer window and look for orthogonal wins beyond tuning this knob further.","candidate":"recent keypress defer 175 ms"}}
{"run":21,"commit":"06a5a41","metric":131.727,"metrics":{"input_median":103.965,"input_max":166.365,"idle_p95":65.596,"active_idle_gap":66.131},"status":"discard","description":"Tried batching thought deltas into a pending buffer during the recent-keypress grace window, then merging them back into the main thought string when rendering resumes.","timestamp":1774403490242,"segment":0,"confidence":22.797555791710877,"asi":{"hypothesis":"After suppressing incremental thought renders during typing bursts, avoiding hidden-string growth during the same burst might reduce UI-thread work further.","learned":"This regressed sharply, so buffering pending thought deltas separately added more overhead/complexity than the saved string churn was worth.","rollback_reason":"Primary metric regressed from 124.18 ms to 131.73 ms.","next_action_hint":"Keep only the lightweight recent-keypress render deferral and avoid secondary pending-buffer machinery.","candidate":"pending thought delta buffer during recent typing"}}
